"Reviewer_name","Review_title","Rating","Date_of_experience","Review_description"
"eivar galindez","john Morris was the travel agent and i","excellent","five august twothousandtwentyfour","john Morris was the travel agent and i have a very good experience he was very friendly patient and helpful the ticket was cheap and according to my expectations thank you"
"usman aziz","a quick response and ticket","excellent","seven august twothousandtwentyfour","a quick response and ticket confirmation thanks to carols for a nice conversation"
"manish shandilya","thank you carols for the help","excellent","seven august twothousandtwentyfour","thank you carols for the help you were amazing in answering my queries"
"mari brisban","superb service","excellent","one august twothousandtwentyfour","rm john Morris is utterly attentive to details and the most professional agent wee done business with he follows up with questions concerns no matter is too small for his time i highly recommend him hes helped us from beginning to end with our trip"
"saranka be","very impressive service","excellent","seven august twothousandtwentyfour","very impressed with the service of travel agent the travel agent Olivia Clark was extremely helpful she helped to manage the booking details"
"michael mbuthia","very impressed with the travel agent","excellent","six august twothousandtwentyfour","vie previously used crystal travel and the travel agent was extremely helpful and he managed to get me a a flight ticket at very a reasonable price with short notice as well this time around vie also being able to book a flight at a very competitive price with the help of yet another travel agent Jose who patiently took his time to go through the options and pointed out the best options his knowledge of the subject matter is impressive and impeccable thank you very much"
"graham","booking my flight","excellent","four august twothousandtwentyfour","booking my flight was very straightforward and stress free thank you to recap for your NA"
"rabin jang magar","awesome site to book a tickets","excellent","six august twothousandtwentyfour","awesome site to book a tickets staff are really helpful and friendly and trustworthy specifically rm Paul was the true example of it what an amazing person"
"david hamilton","outstanding service","excellent","six august twothousandtwentyfour","Ana swift dealt with our travel plans she was outstanding nothing was too much trouble helpful and knowledgeable everything went so smoothly no stress no hassle delighted with the service received"
"mandi ocallaghan","Alice car dona the rep was very good and","excellent","six august twothousandtwentyfour","Alice car dona the rep was very good and quick at solving my problem would definitely recommend this travel agents i was very well looked after"
"h z moham","thanks for everything","excellent","six august twothousandtwentyfour","thanks for everything your the best you know i have planned many trips with crystal travel agents and i must say you are truly one of the best agent agency i have had the pleasure to interact with we thank you very much for all your work and dedication to make this trip happen special thanks to Jose Wilson"
"hitesh","nice efficient service very satisfied","excellent","six august twothousandtwentyfour","nice efficient service very satisfied with the high level of service given by Arron"
"luci wood","excellent and efficient","excellent","six august twothousandtwentyfour","Candice dealt with my booking of seats she was very professional thorough and explained everything absolutely fantastic service thank you Candice"
"victor kalota","fantastic safari travel booking","excellent","four july twothousandtwentyfour","crystal travel were fantastic again after i previously used them in Jerry Wilson my travel agent was impeccable as ever and was very efficient with the way he handled my booking i got confirmation of the booking within minutes with no problem at all i highly recommend crystal travel as a travel agent of choice and will be using them in future"
"spg","Aron is a great help and easy to talk","excellent","six august twothousandtwentyfour","Aron is a great help and easy to talk to appreciate the effort and bearing with me many thanks"
"marshal barn","","excellent","five august twothousandtwentyfour","i recently had the pleasure of working with peter Cruz at crystal travel and i cant recommend them highly enough from the very start peter Cruz took the time to understand my travel preferences and budget he provided a range of options that perfectly matched what i was looking forth entire planning process was seamless he was always available to answer my questions no matter how small and his attention to detail was impressive i appreciated the personalized approach to support me in booking my flight overall my experience with peter Cruz was exceptional and i will definitely be returning for my future travel needs thank you for making my booking so affordable and effortless"
"emili","reliable support and well priced tickets","excellent","twentysix june twothousandtwentyfour","i was booking travel to south chorea for a summer programmer and being a student i was looking to save money on flights so i could have more for spending while i was over there i found crystal travel through sky scanner and the prices looked too good to be true which usually means it is however my experience couldn't be more the opposite i got a call the morning after i booked them where i had the pleasure of being handled by Stella she was wonderful and very patient as she explained everything i needed to know or was confused about and even hung on the line as i coordinated seat plans with my friend who had booked the same flights as i did very lovely and kind it was easy to collect the tickets at the airport i just printed the boarding pass i was emailed and continued with check in at the desks as i would if i had booked with chi i had no problems whatsoever with any of the flights and as i took six flights in total there and return this is a huge feat my only really minor complaint is that perhaps they pushed the give us a star review thing a little too much and as i prefer to wait until after i experience something to review it and i felt bad for waiting this time but again it is such a minor thing and ultimately i do really recommend crystal travel its quick easy and reliable"
"inbal","not only did christen respond quickly to","excellent","five august twothousandtwentyfour","not only did christen respond quickly to my questions but she also did so with kindness and patience ensuring that every detail was perfect thank you for that"
"paul thoma","just spoke to Alice concerning our","excellent","five august twothousandtwentyfour","just spoke to Alice concerning our baggage allowance she was most helpful and friendly always a pleasure dealing with crystal travel"
"jet pineda","booking inquiry","excellent","four august twothousandtwentyfour","i made a query regarding my booking and Candice stone was very helpful five stars for her"
"han","star customer service","excellent","four august twothousandtwentyfour","customer service my initial booking was done by papilla and he ensured that everything was correctly he also informed me of the services crystal travel had available our ticket was on a pay monthly installment which allowed us to budget things month before we were due to travel i spoke to Freya to ensure that the tickets we booked were paid for and seats were allocated she ensured me that everything was ready for the upcoming trip she called me back to confirm everything was done and now i can finally relax looking forward for my holiday"
"custom","it was helpful from ash ton ditz the","excellent","four august twothousandtwentyfour","it was helpful from ash ton ditz the representative who helped me with the booking and changing the date of birth of my wife it was a great help"
"nsunda ntumba","i spoke with Freya about my e ticket","excellent","four august twothousandtwentyfour","i spoke with Freya about my e ticket and in minutes my issue has been resolved so thanks so much i always buy tickets from crystal travel because they are good"
"anel dube","vie been assisted by frank","excellent","nineteen july twothousandtwentyfour","vie been assisted by frank he is patient and finds the best deals"
"jim cragg","Zara Lopez took great care of my","excellent","four august twothousandtwentyfour","Zara Lopez took great care of my flights no problems at all thank you"
"eric kinyanjui","john Morris was very helpful and i","excellent","three august twothousandtwentyfour","john Morris was very helpful and i would recommend him to anyone wishing to use crystal travel for any flights"
"mr anthoni constantin","excellent response in a crisis","excellent","three august twothousandtwentyfour","the staff at crystal travel are excellent British airways canceled my flight and crystal travel responded immediately efficiently to this situation there were extremely helpful calm and patient and found me an alternative flight and even dealt with a refund i am amazed at their excellent service at such a late time in the evening"
"mr white","Sofia was the most helpful assistant","excellent","two august twothousandtwentyfour","Sofia was the most helpful patient and polite assistant we managed to book a complicated flight that would not have been possible without her help"
"russel wilcox","i spoke to a gentleman called john at","excellent","three august twothousandtwentyfour","i spoke to a gentleman called john at crystal travel to whom was most helpful polite and considerate"
"jame papachan","great service by Candice","excellent","two august twothousandtwentyfour","great service by Candice"
"joom","cannot be trusted","bad","two january twothousandtwentyfour","in the weeks following booking and before departure of my flights were changed although informed i still missed the return flight and had to buy another ticket although the fault was mine i was told i could reclaim the airport taxes paid twice although used once the airline said this was up to the travel agent after phone calls and emails Thomas said he would look into it and call back the following month he did not and i also had no response to my follow up email what is the point of booking through an agent and paying them their commissions if they do not act for their customers when someone says he will phone back and does not then he lies and cannot be trusted on other points the prices on crystal travel website were outdated at time of phoning and prices were generally a couple hundred more expensive than advertised although i received email for ticket i did not receive a receipt for the most expensive ticket i have purchased had previously booked flights with crystal travel but never again very much hope that potential customers look elsewhere"
"peddington kunaka","good customer care and professionalism","excellent","two august twothousandtwentyfour","i made an inquiry for the tickets to travel to Zimbabwe and i spoke to Shirley smith who was very patient with me she helped me and my family to get the cheapest fares with less hours travel with the way Shirley smith supported us to get cheapest tickets her patients and good customer care has made us as a family to use crystal travel in all out future flights bookings keep the good work Shirley you are awesome"
"teberen","Candice stone was really helpful","excellent","two august twothousandtwentyfour","Candice stone was really helpful"
"devon resid","working with crystal travel to book seats flights our","excellent","two august twothousandtwentyfour","working with crystal travel to book our flights to Australia via Mauritius was made very easy when i needed to secure my seating for the return flight i spoke with Stella Stevens who was extremely helpful not only did she callback when i had called previously she was extremely patient with me during the seat selection payment process esp as it requires email confirmation etc although the whole flight booking process can take a bit of time its well worth it as the team are very patient thorough professional i can fully recommend crystal travel would use them again"
"mr nichola georgiou","christen did a great job","excellent","two august twothousandtwentyfour","christen did a great job quick and efficient"
"andrew walmsley","font trust advertised price","bad","twentyfive july twothousandtwentyfour","tried to book flights at advertised price booking rejected as flights font exist at that price"
"andrew cook","dishonest pricing","bad","thirty july twothousandtwentyfour","crystal travel simply quotes unavailable fares on kayak and then take all your details and payment details and then phone you to say that fare is not available and offers much higher fares they consistently do this they make no attempt to update the fares or even to check its availability before asking for credit card details they say dynamic pricing but this is just a pathetic excuse as the same low unavailable prices stay on kayaks site day after day after day week after week its just a big con dishonest"
"siva kailasam","Olivia Clark helped us to complete the","excellent","thirty july twothousandtwentyfour","Olivia Clark helped us to complete the flight booking thanks"
"ann rzezniczak","frank was excellent","excellent","twelve july twothousandtwentyfour","frank was terrific at sorting out my complicated travel requirements it is absolutely great being able to talk to someone to help you instead of messing around online he is in my book for all my future travel arrangements"
"chen ose","rm demonstrativeness handmade","excellent","thirteen july twothousandtwentyfour","rm nonathletic professionalism and courteous demeanor made the entire booking process smooth and stress free his excellent service has left positive impression on me and i will not hesitate crystal travel to others based on this experience"
"jack walker","got a reasonable priced flight and it","excellent","sixteen july twothousandtwentyfour","got a reasonable priced flight and it was a quick and simple process inc bazaar informing me flight details had changed and updated my tickets"
"insightcoach","from start to finish the booking was","good","nineteen july twothousandtwentyfour","from start to finish the booking was professionally done friendly and efficient very glad that Gerry was able to help us book flights to the us"
"alishan khan","fantastic customer service and pricing","excellent","thirty july twothousandtwentyfour","fantastic customer service and pricing always quick to respond to any request which is why we use travel online as our preferred agent peter he is just amazing and deal very nicely"
"ahm omar","Nathan has been very helpful in finding","excellent","thirtyone july twothousandtwentyfour","Nathan has been very helpful in finding me a ticket to visit Kenya he compared different prices for me and helped me find the best price to meet my needs"
"chandni nesar","everything was made easy by booking","excellent","ten july twothousandtwentyfour","everything was made easy by booking through crystal travel from flights transfers and accommodation everything went to plan made the holiday enjoyable with not worrying as everything was per organized by peter thank you so much"
"yasmin sharaf","good deals","excellent","thirty july twothousandtwentyfour","i found the service and response of this travel agency to be excellent easily stars my emails were promptly responded to credit goes to James smith as he is dealt with my query promptly i have done booking with him in the past and had a good experience is the reason for me to come back to crystal travel"
"rini packaya","excellent experience with crystal","excellent","seven june twothousandtwentyfour","excellent experience with crystal travel where representative peter was sew kind and helpful to find me good flight with my new born baby really appreciated and keep up the good work we really had a comfortable journey keep it up"
"shruti","thanks Jerry for your kind assistance","excellent","thirtyone july twothousandtwentyfour","my experience was good Olivia Clark was very helpful in answering my questions thanks Olivia"
"bisi","my experience was good","excellent","thirty july twothousandtwentyfour","thank you bazaar for your assistance great experience"
"megha","thank you bazaar for your assistance","excellent","twentynine july twothousandtwentyfour","Freya from crystal travel was helpful and dealt with my queries swiftly"
"mariv wright","Freya from crystal travel was helpful","good","thirtyone july twothousandtwentyfour","would like to say thank you to Olivia for assisting me on my payment ticket booking kind regards Frederick salmon"
"andrew","would like to say thank you to Olivia","excellent","thirtyone july twothousandtwentyfour","very helpful am very with service given by ran old"
"bhupind singh kainth","very helpful","excellent","thirtyone july twothousandtwentyfour","this is my second time using jack from crystal travel absolutely superb i would not want anyone else to book my holiday jack takes all the stress away from booking a holiday and you will not be let down"
"naz","superb service from crustal travel","excellent","thirtyone july twothousandtwentyfour","Ronald gave me the best flight option going to Delhi"
"poonam bhasin","Ronald gave me the best flight option","excellent","thirtyone july twothousandtwentyfour","Ronald gave me best service for booking the flights to Mumbai with best professionalism and customer service"
"frazisko","Ronald gave me best service for booking","excellent","thirtyone july twothousandtwentyfour",NA
"mike packham","Faye Donovan was very helpful","excellent","thirtyone july twothousandtwentyfour","Faye Donovan was very helpful she had been advised that reserving seats in business class was a chargeable service however when i advised her it was not chargeable with business class she checked and immediately reserved our chosen seat swell done Faye"
"sanjay chowdhuri","Jerry has been very helpful with my","excellent","eleven june twothousandtwentyfour","Jerry has been very helpful with my travel reservations"
"chris simm","safe hands","excellent","thirtyone july twothousandtwentyfour","last minute issue with our booking which ash ton ditz sorted out promptly keeping us up to date all the way"
"anita islam","frank was superb","excellent","twentynine july twothousandtwentyfour","frank who made my booking earlier was supportive for rebuking my flights though i had to pay a lot for flight changing and rebuking which was not in their hands i belie he was emphatic and patience dealing with it i wish all the best for frank and crystal travel team"
"kamran ali","i am extremely satisfied with Jose","excellent","twentynine july twothousandtwentyfour","i am extremely satisfied with Jose Wilson he give very good service"
"mari","thank you crystal travel UK esp to Alice","excellent","thirtyone july twothousandtwentyfour","thank you crystal travel UK especially to Alice who assisted me in checking in seat allocation and with our boarding pass so friendly accommodating and patient keep up the good work"
"ijaz ahmad","i had a booking with Jose in march this","excellent","twentyfour march twothousandtwentyfour","i had a booking with Jose in march this year service was excellent everything was easy and we had a great time on our holiday"
"vincentia opara","best expert on traveling flight ticket","excellent","thirtyone july twothousandtwentyfour","Jose is great customer in terms of flight ticket last ticket i bought it was quite difficult due to cost of living he was able to help me get fix with a great discount on flight he is a very good guy and concerns and fight hard to get within your budget as he consult to many air line i recommend him"
"owen madriaga","i was given and offered the flight i","good","eighteen july twothousandtwentyfour","i was given and offered the flight i required and frank was really helpful in finding a flight for me and he calls me to update me with some options"
"ola kaz","the agent was able to help with the","excellent","eight july twothousandtwentyfour","the agent was able to help with the booking seamlessly without any issue and have a good understanding of the product crystal as a company have been able to get better flights than what is obtainable online coupled with flexible payment terms well done"
"consum","i am very pleased with crystal travel","excellent","thirtyone july twothousandtwentyfour","i am very pleased with crystal travel their sales consultant jack Tyler is very good highly recommend anyone to book your flight with crystal travel thanks so much"
"fakhrul bhuiyan","fantastic service received from sales","excellent","thirty july twothousandtwentyfour","fantastic service received from sales consultant Ronald professional and expert thanks"
"babaluv","excellent service from Ronald","excellent","thirty july twothousandtwentyfour","excellent service from Ronald will use again in the future highly recommended"
"michael full","christen was brilliant","excellent","thirty july twothousandtwentyfour","following a flight change from Bogota to London christen took control and confirmed the new flight and the connecting details which were absolutely perfect i font think we could ask for better service they dealt with it in minutes after i have tried all day to make contact with British airways who should be ashamed of their telephone service"
"julius adedunmoy","paying attention to details and prompt","excellent","twentynine july twothousandtwentyfour","paying attention to details and prompt followup by your staff frank gave me customer experience strategy i covert in business transactions well done crystal travel well done frank keep it up"
"custom","just scammers","below average","thirty july twothousandtwentyfour","do not be scammed by this bunch once to try booking your booking is declined tried days in a row for not having the seats available at the stated price someone will then call you back and tell you only the next level of ticket is available but its more money they blame the airline even though the price stays the same day after day cheap flights should be banning these companies from doing this because i know ill never use them again and ill stick with sky scanner never an issue in years with them unfortunately i cant put up all the pictures i took over the past few days to show and prove their lies and deceit trust me use another company other then them"
"myra laugo","very helpful and efficient","excellent","twentysix july twothousandtwentyfour","very helpful and efficient"
"clovi nkunga","i was very satisfied from services i get","excellent","thirty july twothousandtwentyfour","i was very satisfied from services i get from Alice car dona"
"elvisa arnaiz","thank you Jerry Wilson for your good","excellent","thirty july twothousandtwentyfour","thank you Jerry Wilson for your good service to us we really appreciate it and my family was happy for your help thank you once again they are enjoying now in the Philippines xxx frolicsome czarina family"
"bernadett villaraiz","staff is very polite and very helpful","excellent","twentynine july twothousandtwentyfour","staff is very polite and very helpful with all my questions very good advice on everything"
"mr plume","Alice car dona was very helpful with my","excellent","twentynine july twothousandtwentyfour","Alice car dona was very helpful with my query"
"robert tettey","Nathan Cole a very honest and","excellent","twentynine july twothousandtwentyfour","Nathan Cole a very honest and trustworthy staff at crystal travel he helped me to land a good flight deal always buy my tickets at crystal travel rob"
"consum","amazing personality with respect","excellent","twentynine july twothousandtwentyfour","amazing personality with respect"
"soon mun lum","Nathan Cole was extremely helpful and","excellent","twentyeight july twothousandtwentyfour","Nathan Cole was extremely helpful and he was able to secure a seat on Saudi as a last minute booking"
"san conwel","well done crystalline travel","excellent","twentynine july twothousandtwentyfour","Freya Donovan at crystal travel was a very NA lady she helped me find seats for my forthcoming trip to Australia Freya was extremely supportive and helpful and patient whilst i tried to make my payment thank you so much refrain definitely recommend you to help people organist flights"
"roshna mote","best service from Jose","excellent","twentyseven july twothousandtwentyfour","best service from NA"
"eleonora lara","Freya she very helpful for her customers","average","twentynine july twothousandtwentyfour","Freya shes very helpful for customers"
"linda cook","after lots of messing about on certain","excellent","twentynine july twothousandtwentyfour","after lots of messing about on certain sites trying to book flights at a reasonable price then proceeding to book it would work out a lot more expensive than originally stated i then decided to phone crystal travel and spoke with Jose who was extremely patient and explained everything to me and organized flights that suited our needs and all at a reasonable price great service"
"robert tettey","crystal travel staff Freya cordovan","excellent","twentysix july twothousandtwentyfour","crystal travel staff Freya cordovan great customer care skills and really helpful carry on doing the good work rob"
"deepwat","very good service","excellent","twentyseven july twothousandtwentyfour","very good service quick efficient"
"nerio lopez","i give stars to nick Jonas for","excellent","twentyeight july twothousandtwentyfour","i give stars to nick Jonas for excellent service he was very kind and helpful regarding my flight query best regards"
"lamhoa","very helpful and sorts out my problem smoothly","excellent","twentyeight july twothousandtwentyfour","very helpful"
