"Reviewer_name","Review_title","Rating","Date_of_experience","Review_description"
"adam shulberg","well done end great job","good","thirteen december twothousandtwentyfour","after some initial frustrations with my booking end stark was patient and came through for us he persevered and called me back even after i had said i would go elsewhere well done end for managing my initial frustrations and delivering an excellent option and superb service"
"custom","booking with no pressure","excellent","twelve december twothousandtwentyfour","made inquiries regarding flights to Mauritius and James smith answered all my queries and showed lots of patience during the whole of the process i have booked my flights and he has made all necessary arrangements for the flight to be trouble free he was courteous and patient throughout"
"sam","ticket for japan trip","good","twelve december twothousandtwentyfour","in July i booked a return ticket from UK to japan for may next year i dealt with crystal travel Carolina drafter months airline for some reasons canceled my return flight but Caroline kindly fix that and issued new ticket with new route for me very kind of her and nice customer service"
"mohammad","wonderful service","excellent","thirteen december twothousandtwentyfour","thank you so much Aron for being so supportive and helpful with purchasing our tickets and providing all the information we needed you have been truly amazing hopefully we will buy our next tickets with you again"
"balvantrai mistri","veronica you are best travel guide help","excellent","nine december twothousandtwentyfour","veronica you are best travel guide help me second time holidays booked by veronica for year i am very happy and when we back home review again how much we enjoyed holidays in Malaysia lawmaking and penance island"
"leigh carpent","advertise the lowest airfare but then","average","twelve december twothousandtwentyfour","advertise the lowest airfare but then once you've given details the booking gets denied and they want you to call so they can sell you a more expensive flight stars because the site is easy to use"
"aldo ranieri","thanks for the help render we are","excellent","thirteen december twothousandtwentyfour","thanks for the help render we are grateful Candice was a great help to use often get tickets due to the excellent customer service render by crystal travel"
"gid","fantastic service provided by Lisa","excellent","eleven december twothousandtwentyfour","fantastic service provided by Lisa she could not have done more to help find and book flights and accommodation at the most competitive price would highly recommend"
"august kolster","changing previously reserved seats","excellent","twelve december twothousandtwentyfour","after booking flights a few weeks ago i called to make a change in the seats that had been reserved for us at that time i was served by Olivia Clark who kindly attended to my request in a pleasant and professional way very pleased thank you"
"roxan de souza","helpful member of crystal travel","excellent","nine december twothousandtwentyfour","a change in the airline schedule threw us off balance however bazaar was able to bring us calm satisfaction when he made the changes after speaking with his manager no additional cost was incurred thank you"
"fernanda cabrera de souza","i recently booked a round trip ticket","excellent","nine december twothousandtwentyfour","i recently booked a round trip ticket from more to so parlous with crystal travel and the experience was excellent the staff flared Shaw was very polite and friendly and he even managed to find a seat with reasonable rate overall the booking process was quick would highly recommend crystal travel for anyone looking for a hassle free and cost effective booking experience ill definitely consider them for my future travel plans"
"maridadi","Aron is a star","excellent","eleven december twothousandtwentyfour","Aron is a star so i keep coming back thank you for your service i know wee gone online for travel but i highly recommend speaking to crystal travel for personalized service"
"mr patel","thank you for great service","excellent","ten december twothousandtwentyfour","excellent service from crystal travel members Freya Donovan and James smith very good experience and support with prompt responses seamless booking ticket from London to abashed with competitive price great service"
"robel teklay","great service with changing my flight to find alternative","excellent","thirteen december twothousandtwentyfour","Carolina ditz helps me to change my flight she is friendly polite and helpful person she is always available and reply your email or call quickly"
"david teboul","second time using this company for","excellent","eleven december twothousandtwentyfour","second time using this company for flights got good rate with speedy service jack handled our requests very well and Freya issued tickets promptly"
"mr luyambi","great customer care service aim greatly","excellent","nine december twothousandtwentyfour","great customer care service aim greatly thrilled with crystal travels excellent service this might be my fourth booking by record and i have never encountered any problem at all i am also pleased with the great customer care service offered by Candice stone today and previously by Carolina ditz Hannah and Ronald for your great care service exhibited"
"p alleyn","booked direct with Aron","excellent","thirteen december twothousandtwentyfour","booked direct with Aron he helped me through the booking process very helpful and patient would highly recommend"
"suhail ahm minnoor","i recently booked flights with joy Wilson","excellent","nine december twothousandtwentyfour","i recently booked flights with joy Wilson in crystal travels in London who has help me and it was a fantastic experience he found a great price on flights and was extremely patient i needed to book tickets the whole process was smooth and easy i highly recommend joy nelsons service to my friends and colleagues for their future booking thanks"
"katherin farrel","although i am always cautious about","excellent","eight december twothousandtwentyfour","although i am always cautious about purchasing products and services online crystal travel have been great although i sent the agent who sold me the flights two emails i dint get a response to either so whether thatch because she only dealt with sales and not after sales i am not sure i have since called customer services several times and they have been proactive and called me back when they say they will they have since not let me down i will definitely use them again lovely staff both Olivia and Freya now i can relax and look forward to seeing my family in new Zealand for Christmas"
"david c michael","Stella was incredibly efficient","excellent","ten december twothousandtwentyfour","Stella was incredibly efficient she helped me chicken right on time and confirmed my booking reference great service at crystal travel"
"bessi","ask for Octavio","excellent","nine december twothousandtwentyfour","i just booked my flight ticket through crystal travel and was helped by Octavio Garcia he was so patient with me explained everything and got me exactly what i wanted he took away the stress and hustle that comes with finding the perfect fight will surely be using him inwards for all my travel thank you Octavio Garcia"
"jose goncalv","i was booking the ticket with other","excellent","nine december twothousandtwentyfour","i was booking the ticket with other company and they take my money but suddenly i found crystal palace which they help me lots to find the cheap tickets for and the give some alternative payment which is help me lots and i am really appreciate what they have done to me recommend"
"jame","tried to book a flight only to have","bad","seven december twothousandtwentyfour","tried to book a flight only to have email that flight not available called and told not ticketed and no longer available said it is still on website jazz promised to call me back within min dint i called back and he said he would escalate and call me back the following day assured me the erroneous ticket price would be removed from website when he called the following day he said more and i said unacceptable especially as they are still showing live the wrong price avoid sharp practice"
"taylor","con artists","bad","seven december twothousandtwentyfour","displaying flights online that you cannot book then try ringing you up once payment is declined asking to change your flight which is double in price just poor marketing"
"adrian pearc","excellent company to deal with stars","excellent","five december twothousandtwentyfour","firstly booking a flight is always stressful you have to make sure everything is covered Ronald did a superb job nothing was too much trouble and he explained things in a manner that calmed my fears right down to the seat choice not to close to the bathrooms etc got to say brilliant service he proper looked after me and i would recommend anyone using crystal travel absolutely with a star rating"
"kris secreto","amazing booking experience with Claire harp","excellent","three december twothousandtwentyfour","travel agent Claire was very helpful and very patient with us she understood our need and was able to deliver what we need as a first time family traveler smooth and easy booking mi not a first time customer and i have always booked with crystal trace very reliable"
"luj s","it was the first time i used crystal","excellent","five december twothousandtwentyfour","it was the first time i used crystal travels it dint start off well but Steve managed to regain my trust and helped book my ticket with all my requirements he made a very stressful task easy and was constantly available with calls and emails very reliable and definitely calling him back for all my future bookings"
"rubi","i been booking my flight with crystal","excellent","fourteen december twothousandtwentyfour","i been booking my flight with crystal travel bad the staff are very accommodating specially Olivia and amnesia can highly recommended crystal travel"
"mari ann","i booked using crystal travel for the","excellent","ten december twothousandtwentyfour","i booked using crystal travel for the second time Freya was very helpful about helping us find our flight information"
"ruth","thanks to john Morris for his great","excellent","twelve december twothousandtwentyfour","thanks to john Morris for his great service he find the best deal for our family holiday"
"mr kung","never used this company before but now","excellent","eight december twothousandtwentyfour","never used this company before but now i will book my holiday trip with no other traveling agents the quick and honest response is unmatched price is very competitive and service is ex temporary i must mention Stella Stevens she made my trip much more relaxing thank you again Stella"
"custom","Lisa was great and helped me book via","excellent","nine december twothousandtwentyfour","Lisa was great and helped me book via phone when the online booking failed she was super clear in communication and offered me good advise"
"erlina","Candice is very kind to me when i","excellent","thirteen december twothousandtwentyfour","Candice is very kind to me when i called to ask something about my flight she sorted out everything very quick and with kindness even she is not my agent when i booked it she still helped me she made sure that everything is sorted"
"christoph thompson","professional and knowledgeable","good","twelve december twothousandtwentyfour","dealt with clear she was professional and knowledgeable about travel price was good and the experience painless"
"adeler jinadu","Aron has really assisted me with my","excellent","twelve december twothousandtwentyfour","Aron has really assisted me with my booking in a professional manner well done"
"bibi fazila","Ronald was very supportive in helping","excellent","twelve december twothousandtwentyfour","Ronald was very supportive in helping us to book our flight to Dubai with the right information to make our booking smoothie kept regular in touch throughout the booking process made sure he met our needs would definitely give him a plus"
"camilosj","reassuring","excellent","three december twothousandtwentyfour","i made my inquiry regarding a flight my family and i made last august to go home in the next few weeks as i cannot confirm the booking on line Freya was very responsive and re assuring shes even immediately return my call when i put it down to look at who did i book with she just put my mind at ease"
"niraj pathar","exceptional service and seamless booking experience","excellent","twentynine november twothousandtwentyfour","i recently booked flights with jerseys help and it was a fantastic experience he found a great price on flights and was extremely patient i needed to book three tickets with two passengers on one booking and one on another but we all wanted to return together Jerry managed to coordinate everything perfectly ensuring we were on the same return flight the whole process was smooth and easy i highly recommend jerseys service"
"meghraj bk","Sergio Gomez is your go to guy if you","excellent","twentynine november twothousandtwentyfour","Sergio Gomez is your go to guy if you want quick and dedicated service he is also very polite considerate and works around work commitments he is patient and he still took the time to ensure that i had heard and understood what he was saying i let him know my wife and my daughter was traveling and there was no question too small he found me the best deal when i would have given up thank you Sergio Gomez my next booking will definitely be with you with kind regardless"
"alan rous","Roland was very helpful and polite when","excellent","eight december twothousandtwentyfour","Roland was very helpful and polite when i was planning a trip to Australia he found a cheaper flight and booked it for me making the job very easy"
"zella h","sketchy experience","below average","twentyseven december twothousandtwentythree","thankfully we were only booking flights to Amsterdam less than anything more expensive and i would've been very uncomfortable received a call to make our booking despite trying to do it online our handler was a chap called Ronnie O'Connor despite having a thick Indian accent which feels dishonest his English level was poor and he barked instructions at us which we were struggling to understand which inst a reassuring situation when theirs money involved he then sent us an email link to a rd party payment site again not sure why i wast allowed to go through the booking process online like any other travel company we were both very skeptical about the process and how unprofessional it had been thankfully our tickets were real and we went on our holiday but i definitely wont be using them again for the sake of saving a few quid avoid"
"raul","flared at crystal travail was really","excellent","three december twothousandtwentyfour","flared at crystal travail was really attentive calmed and professional and helped me out with the airline ref number as i wanted to be checked in this early flight they offered the fare and honored it recommended"
"dudley van lelyveld","James smith","excellent","three december twothousandtwentyfour","James smith handled our requests for various flight quotes followed by numerous changes efficiently and professionally we have ended up with very attractive fares from London to Sydney and James explained everything to us as well as handling our seat allocations"
"lizzi h","Aaron was so professional and patient","excellent","thirteen december twothousandtwentyfour","Aaron was so professional and patient with my booking thank you"
"darren jone","i booked my flight months ago with","excellent","thirty november twothousandtwentyfour","i booked my flight months ago with Olivia Clark and she was very nice and professional and found us an amazing deal on our flights after she completed the booked she said she would call back the day before a fly and help me check invasive just had her on the phone and has checked me and my wife uni am so grateful for all the assistance and would recommend crystal travel to anyone looking for an amazing travel company thatch goes out of there way to make the experience of traveling more easy thanks once again Olivia crankshafts darner Jones"
"mr john david lloyd","date change","excellent","nine december twothousandtwentyfour","this was the rd or ht time i have used crystal travel bazaar continued my star experience with the agency thank you"
"sarah jame","spoke with Stella","excellent","twelve december twothousandtwentyfour","spoke with Stella really helpful and made the whole experience a breeze"
"mariam k","i have been attended to by a very","excellent","three december twothousandtwentyfour","i have been attended to by a very efficient staff member by the name of SAM Jones my inquiry was dealt with very promptly i will definitely recommend crystal travel to my friends and family i look forward to more future bookings with you"
"andrew","end provided great suggestions and","excellent","twelve december twothousandtwentyfour","end provided great suggestions and support in finding best flight"
"paul","great customer service","excellent","thirteen december twothousandtwentyfour","flared was very efficient and helped me with my booking"
"rajib talukdar","i am very thankful to Claire for her","excellent","thirty november twothousandtwentyfour","i am very thankful to Claire for her help to sort my tickets i am booking a month before she was very supportive and gave me plenty of option to pay for my tickets usually this kind of service we never expect thank you crystal travel for being part of my journey and make it easier simple"
"ali","a big thank you again to the Claire harp","excellent","twentyeight november twothousandtwentyfour","a big thank you again to the crystal travel family and especially Claire your kindness and efforts are truly appreciated and what you would wish to be dealt with by all in any business in the manner of which you provided the service definitely not the first time and surely not the last will be dealing with you again thank you so much"
"norma mckenna","the staff Stella Stevens who assisted","excellent","three december twothousandtwentyfour","the staff Stella Stevens who assisted me today was very polite helpful approachable very efficient she has gone the extra mile i am really pleased with the service so far many thanks"
"mr sze lo","stop misleading customers","below average","thirteen december twothousandtwentyfour","stop misleading customers stop advertising cheaper fares never available always unable to book total bullshit"
"babu ram thapa","excellent service from all the team","excellent","five december twothousandtwentyfour","excellent service from all the team flared Shaw has been exceptionally helpful in sorting out my issues with great patience and understanding thank you all for your excellent service at crystal travels good company and reliable too"
"andrew l","helpful and friendly","excellent","twentyeight november twothousandtwentyfour","i was having problems trying to log in to the china southern web site to select and confirm seats on my upcoming trip from the UK to new Zealand so i called crystal travel and spoke with Freya she was able to resolve my problem within minutes highly recommended thank you"
"bipin bhatt","crystal booking","excellent","seven december twothousandtwentyfour","best and competitive site for the tickets Claire harp made the booking quick easy and wonderful experience very polite and helpful highly recommend"
"david gennard","crystal travel were excellent inserting out my request","good","twentyeight november twothousandtwentyfour","crystal travel were excellent in helping me book seating for my flights to Bangkok with Turkish airliner Donovan especially went out of her way to find seating for me and my wife never used crystal travel before but certainly will in the future"
"khaleda hossain","excellent service","average","two december twothousandtwentyfour","we are very pleased with booking our USA tickets at the final critical moment very friendly and reliable customer service whoever required help ask for James smith very good understanding person just keeping stars save for later after visiting the destination"
"vanessa","amazing service and results","excellent","twentysix november twothousandtwentyfour","i have used crystal travel twice recently and they have found me great flights and deals especially john Morris who was amazing highly recommend using this company especially for multi flight destinations"
"l hatteea","superb company","excellent","two december twothousandtwentyfour","the attendant seed Morgan was superb he was very helpful trying to find better fares for my trip crystal travel is the best fares in ti days search for holidays i recommend them"
"denis","new Zealand","good","twentysix november twothousandtwentyfour","new Zealand i have given this review based on my experience having now booked my surprise flight for my partners Christmas present it taken two days but none stop messaging and phone calls until i had paid has made me mark it down Arron the man for this company called me himself today and was very helpful"
"custom","easy to book to Aron","excellent","twelve december twothousandtwentyfour","easy to book give all i right information am really happy to booked with crystal travel"
"ilya musa","just booked some flights with Lisa and","excellent","two december twothousandtwentyfour","just booked some flights with Lisa and have to say she gave excellent customer service whilst i was somewhat challenging in my request well done"
"bever king","jack was extremely helpful and patient","excellent","twentynine november twothousandtwentyfour","jack was extremely helpful and patient he was polite and listened carefully to ensure the needs of my elderly family member were met i will definitely use crystal travel again"
"paul smart","font bother the fare will not exist","bad","twentyfive november twothousandtwentyfour","i font know why i even tried yet again the fare offered and accepted by me was unavailable after i had filled in all pa details plus payment info it will be front page news when these clowns actually do represent an honest available fare these guys are bait and switch con artists and should be hounded by trading standards avoid"
"lisabarnett","great service","excellent","twentyseven november twothousandtwentyfour","i have booked through crystal travel a few times now and always found it an easy and pleasant experience and having just done so again with Ana helping me and patiently answering questions i am again so happy with the service and help provided went above and beyond to help me book my flights thank you Ana"
"vimi naiko","today i was looking for a better price","excellent","twentyseven november twothousandtwentyfour","today i was looking for a better price ticket searching online luckily i came across crystal travel and rm jack who was on customer service desk he has help me to find the fare that i was looking for and i will definitely say i was very nice talking to him and the service that he provided today was excellent i definitely recommend him next time to all my friends n families"
"karri","thank you to Calvin and christen","good","twentythree november twothousandtwentyfour","id like to thank Calvin for helping me sort out alternative tickets at a similar price when the initial price point tickets were actually sold out but still showing on kayak the only thing is that i thought id have the tickets sent that day but i followed up with christen the next day and she was able to sort that out and waited until i received the email with the tickets before hanging up she also helped with seat requests and special meal requests etc"
"drive safe","i was referred to crystal travel","excellent","twentysix november twothousandtwentyfour","i was referred to crystal travel through a friend who had a great experience so i would really like to share mine i was put through to a gentleman by the name of Aron who was extremely easy to talk to and well mannered he was thoroughly helpful and made the whole experience so easy i would definitely recommend these guys to my friends and family"
"darrel allan","olive Clark was extremely helpful in","excellent","four december twothousandtwentyfour","olive Clark was extremely helpful in sorting out some issues i had with Kenya airways booking particular seats amending my personal information etc and just being very helpful many thanks"
"juli thomson","Olivia Clark was very polite patient and","excellent","thirty november twothousandtwentyfour","Olivia Clark was very polite and helpful with my query she was very patient and update me step by step with the payment process have a great weekend leviathans is my second time using crystal travel agency and please to say i am happy with the service and will recommend to family and friends"
"juliani davi","i am very pleased with the customer","excellent","nineteen november twothousandtwentyfour","i am very pleased with the customer service i received from coronary has been honest and reliable from me making an inquiry to buying my ticket he took his time and confidently explained every step of the process to me at the end i was convinced that Aron could be trusted and i should book my flight with him crystal travel just wish all traveling agents can replicate such honesty and professionalism was able to make my day"
"customecarolyn r","very helpful and polite","excellent","twentynine november twothousandtwentyfour","this young man explained everything made it very easy to understand how crystal travel workshy was also willing and prompt to answer any questions on my flight"
