"Reviewer_name","Review_title","Rating","Date_of_experience","Review_description"
"rodel","crystal travel agency is reliable trusted","excellent","thirteen october twothousandtwentyfour","crystal travel agency is reliable and very helpful what ever you need regarding to your flight your expectations will be met also Olivia Clark is one of the most friendliest helpful customer service reps you can get"
"rash","Freya was very good and very helpful","excellent","twelve october twothousandtwentyfour","Freya was very good and very helpful"
"arfan ali","thank you so much Claire for your wonderful service","excellent","twelve october twothousandtwentyfour","a big thank you again to the crystal family and especially Claire harp i have been booking with this company me n my family and friends for few years and have never been disappointed at all the staff and service have been amazing as always and the level of politeness and care they talk to you with and especially listen to you is exactly what you would expect dealing with any company thanks once again and surely not the last time i will be writing a review for them"
"rebecca holloway","very helpful and accommodating staff","excellent","twelve october twothousandtwentyfour","very helpful and accommodating staff her name Freya d thank you"
"nitin shah","Freya Donovan","excellent","twelve october twothousandtwentyfour","Freya Donovan was very helpful friendly knowledgeable polite"
"ian bell","fantastic help","excellent","twelve october twothousandtwentyfour","fantastic help"
"iri coomber","she was very polite and helpful","excellent","twentyseven september twothousandtwentyfour","i have booked for the rd time very good company James smith was excellent booking our flight"
"pupuch pupu","Olivia give a great service","excellent","twelve october twothousandtwentyfour","flared and joy at crystal travel were awesome"
"mr robert brennan","i have booked for the rd time","excellent","ten october twothousandtwentyfour","fared Shaw was very patient with me help to resolve my issue with check in i will recommend crystal travel to anyone excellent service"
"jame","flared and joy at crystal travel were","excellent","eleven october twothousandtwentyfour","Stella was very helpful in reserving my parents seats on their long haul flight"
"grace tan","fared Shaw was very patient with me","excellent","ten october twothousandtwentyfour","very helpful and excellent customer service as always the customer service agent was very patient polite and swift in confirming my booking have used crystal for a while know and will continue to do so"
"rumela","helpful","excellent","nine october twothousandtwentyfour","affordable price compared to other providers quick follow up from the staff"
"kashif","very helpful and excellent customer","excellent","seven october twothousandtwentyfour","trust able website got all the help finding good deals on booking my flights whereas the colleague named Sergio homes put his full effort to find me a good deal on flights i have booked with him the ND time and it was all i needed the help"
"leonora enriquez","affordable price compared to other","excellent","nine october twothousandtwentyfour","everyone i dealt with at crystal travel was polite helpful knowledgeable and very professional particular mention goes to naan swift who went above and beyond i would not hesitate to recommend crystal travel thank you to the whole team"
"mrs evangelin moreno","Stella has been very helpful","excellent","nine october twothousandtwentyfour","Sergio has been so so helpful and very patient the service is always fantastic"
"bhumika nitin sawant","trust able website","excellent","nine october twothousandtwentyfour",NA
"paul spice","very helpful team","excellent","nine october twothousandtwentyfour",NA
"jawad pervez","good experience with them","excellent","eight october twothousandtwentyfour",NA
"sb","Sergio has been so so helpful and very","excellent","twentyfive september twothousandtwentyfour",NA
"elena haro","Stella has been very helpful and","excellent","nine october twothousandtwentyfour","Stella has been very helpful and professional in helping me book seats for my parents she speaks clearly and calmly"
"mike davidson","email problems sorted out","excellent","nine october twothousandtwentyfour","following a completed reservation Candice was very helpful in sending our tickets to a new email following tb technical problems with the original email thanks again Candice and crystal travel"
"mam tuti john","thank you so much rm Aron you made my book so easy you treated me with respect and your so good in your job","excellent","nine october twothousandtwentyfour","my booking went so well rm Aron done a very good job and i am very pleased to say thank you to him he treated me with high respect he was so kind and polite thank you rm Aron"
"fred kleinsing","fake credit card declined message","bad","eight october twothousandtwentyfour","i attempted to book flights from us to japan on crystal website the booking was declined according to their website i called my credit card company they had no evidence of receiving any charge from this company i see this pattern on other reviews of this website i called crystal and they again claimed it was the credit card company you can do much better"
"solomon","second to none","excellent","eight october twothousandtwentyfour","second to none thanks to Sergio hes fantastic"
"michael smithson","change to our flight schedule","excellent","eight october twothousandtwentyfour","i was contacted by crystal travel to get in touch to a change in my flight times i spoke with a lady called Freya who put me on the right track she was very helpful and pleasant to deal with many thanks"
"rima fernand","best travel agent to book tickets","excellent","eight october twothousandtwentyfour","best travel agents book your flight"
"mare","Aron","excellent","eight october twothousandtwentyfour","good staff helpful"
"jax kunix","crystal travel is very efficient and","excellent","eight october twothousandtwentyfour","crystal travel is very efficient and Sergio the gentleman i dealt with was very helpful and pleasant stars"
"ian","i have not used crystal travel","excellent","eight october twothousandtwentyfour","i have not used crystal travel before but i found Ana to be helpful professional and highly responsive to my needs she answered all my questions clearly taking me through the whole process of finding and booking my flights patiently and carefully will be using crystal travel in the future and will recommend to my friends thank you Ana"
"salvator fileccia","great company reasonable prices","excellent","seven october twothousandtwentyfour","i have used crystal travel before and i must say they have always been very helpful and quick on sorting out my queries i spoke to Claire today and she was very helpful and honest to find me a reasonable price to my destination i truly recommend this company"
"babafemi bejid","it is wonderful telephone call with","excellent","seven october twothousandtwentyfour","it is wonderful telephone call with Freya Donovan she sorted my issues within mind and my ticker was issued whilst on the phone i cant be happier than this"
"mrs baldish kaur khaira","i recently used crystal travel and","excellent","seven october twothousandtwentyfour","i recently used crystal travel and Olivia made my experience amazing shes very professional and very helpful ill highly recommend her she dealt with my query very friendly and patiently"
"naureen yawar","Sergio Gomez","excellent","seven october twothousandtwentyfour","Sergio helped me in no time he was efficient and professional at the same time he was kind and did not show any signs of being impatient with my questions thank you so much"
"isimem charl","great job and team work with the help","good","seven october twothousandtwentyfour","great job and team work with the help of Jose got things done easy and quick"
"jacqui dunphi","Jose was very helpful and hot out","good","seven october twothousandtwentyfour","Jose was very helpful and got out flights sorted very quickly and confirmed will use Jose again for our flights thanks"
"somina","it was such a good customer service","excellent","seven october twothousandtwentyfour","it was such a good customer service from carols easy quick and flow of communication was nice"
"jonathan baybay","exceptional service","excellent","six october twothousandtwentyfour","Olivia Clarke was very helpful in every way possible"
"mare dolor datulayta","thanks to crystal travel one of the","excellent","seven october twothousandtwentyfour","thanks to crystal travel one of the best travel agency you could rely nontrivial Clark helps me today your fantastic"
"ricardo","thank you","excellent","seven october twothousandtwentyfour","thanks for your assistance Ronald for your patience and expertise regarding my itinerary you provided me with different options which gives me ideas which suits my travel preference even better more power to you and to crystal travel agency"
"nuhm squad","as always time after time care for peter Cruz top agent","excellent","six october twothousandtwentyfour","as always time after time care for customer is in excellence peter Cruz a symbolic personal in the customer relationship an extraordinary individual who let all the possibilities in front to cater clients will definitely recommend the business with crystal travel as a dependable company to avail flights for holiday or any sort of occasion very happy with them"
"mare howe","i have spoken to Stella who has helped","excellent","six october twothousandtwentyfour","i have spoken to Stella who has helped me a lot in sorting my final payment towards my flight to manila on December and arranging my business class seats and wheelchair requests crystal travel has never disappointed me thank you Stella wonderful service"
"mr riggi pagotaisidro","i really appreciate all the help given","excellent","six october twothousandtwentyfour","i really appreciate all the help given by rm areas khan towards buying a new ticket hes so professional and very kind keep up the good job"
"rosemari ling","great service","excellent","six october twothousandtwentyfour","lovely service from Candice at crystal travel she was extremely helpful and very polite"
"judith ndiomaluk okek","highly impressed","excellent","five october twothousandtwentyfour","i hardly leave a feedback but am highly impressed and pleased on how john Morris responded to me when he picked up the call he sounded very cheerful polite and kind he checked for flight avail abilities looking out for me and my kids my best interests towards best prices offers luggage and convenience he found and booked me in including payment made within minutes been very careful and reconfirming my details to make sure there was no error his such a polite and patient fellow and has now made me to trust and have confidence in the services crystal travel provides a job well done john Morris"
"custom","Oscar was excellent in soughing out","excellent","five october twothousandtwentyfour","Oscar was excellent in soughing out our flight changes many thanks"
"emmanuel cabal","Sergio Gomez demonstrated exceptional","excellent","five october twothousandtwentyfour","Sergio Gomez demonstrated exceptional patience and dedication as he diligently searched for the best flight to accommodate all my requirements i was pleasantly surprised when he found the cheapest option with a short stopover provided by an excellent airline"
"custom","coronals enthusiasm for his job really","excellent","five october twothousandtwentyfour","coronals enthusiasm for his job really shows when it comes to providing quality and the best prices for our families travel thank you Ronald Erwin family"
"ofelia tabot","very happy with my professional service","good","five october twothousandtwentyfour","very happy with my professional service of Ana smith in crystal travel we got ticket immediately at affordable price highly recommended"
"ma lourd cerezo","Aron was really friendly and helped me","excellent","five october twothousandtwentyfour","Aron was really friendly and helped me book the best ticket i can have"
"tasneem alibhai","Freya was excellent and very helpful","excellent","four october twothousandtwentyfour","Freya was excellent and very helpful thanks again"
"natali","customer focused","excellent","four october twothousandtwentyfour","i spoke to Stella Stevens and query about registering our passport details on the airline website Stella answered all my questions and kindly helped me with the registration and emailed me when it was done as promised i appreciate the assistance and good customer service and will recommend crystal travel to anyone we done Stella"
"dil kumari","thank you carols","excellent","four october twothousandtwentyfour","judo for ms Claire she has gone above and beyond to help me booked tickets to Vietnam"
"tai dinh","judo for ms Claire she has gone above and beyond to help me booked tickets to Vietnam","excellent","four october twothousandtwentyfour","spoke to bazaar to get tickets sent through upon full payment being made like all the staff at crystal would recommend this agent to anyone they call when they say they will and try and resolve your issues quickly best travel agent vie used in recent times"
"n dale","customer service tickets","excellent","two october twothousandtwentyfour","nice and friendly"
"neomi green","nice and friendly","excellent","two october twothousandtwentyfour","thank you for your patience and assistance in such quick time and making it affordable"
"la toya jone yearwood","thank you for your patience and","excellent","four october twothousandtwentyfour","thank you carols you were brilliant"
"daniel barlow","thank you carols","excellent","four october twothousandtwentyfour","great experience Ryan was great and sorted all quickly thanks"
"s sha","great experience","excellent","three october twothousandtwentyfour","Stella noncrystalline travel i can say you are massing very kindly helpful to do my ticket booking for London heath row to longhand h to manila philandering return to from manila longshoreman to London weatherproof pacific NA pined"
"star light","Stella Steven","excellent","three october twothousandtwentyfour",NA
"ruth cayabyab","i just booked my holiday travel","excellent","three october twothousandtwentyfour","i just booked my holiday travel to Philippines and i was attended by Ronald who has all the patience in understanding with my queries and repetitive questions he has been very accommodating and helping me with my flight including the seat reservation thank you for your help and patience Ronald i surely be booking flights with you again in the future and recommend you as well thank you again"
"miss suki johal","the service i received was excellent","excellent","three october twothousandtwentyfour","the service i received was excellent i would definitely be using the service again and surely will recommend it to everyone who wants to travel my assistant Sergio gave me great customer service was professional and very helpful and swift thank you crystal travel Sergio miss ski aloha"
"lai","true professional","excellent","three october twothousandtwentyfour","true professional seed was absolutely top notch would love to book flights with them again"
"colin radford","great service in challenging times","excellent","three october twothousandtwentyfour","SAM Jones was responsible for the star service i wish the same could have been said for virgin Atlantic who took months to issue a refund to crystal travel very professional service and i will definitely book with them again thanks again SAM"
"leah callegari","would highly recommend","excellent","three october twothousandtwentyfour","i have recently booked a long haul international flight through crystal travel and i am very happy with the service i have been dealing with staff member Claire who has gone over and above to support she is lovely and has taken all of my families individual needs and found out perfect flight we are very happy and would use crystal again due to this experience"
"l abercrombi","operator very helpful","excellent","three october twothousandtwentyfour","in the purchasing of tickets and any subsequent queries operators took the time to find out exactly what was needed"
"mrscarolynk","Carolina kept in touch as our home bound","excellent","three october twothousandtwentyfour","Carolina kept in touch as our home bound flight had been changed the reason we took direct flight is because l am dialed"
"custom","effective and considerate","excellent","three october twothousandtwentyfour","Claire was very considerate to our questions and queries which makes any traveler comfortable and relaxed she made things easy for us very welcoming and to the point every time we called her on phone very approachable thanks"
"leroimac","customer support as it should be","excellent","two october twothousandtwentyfour","the operative Candice stone was a credit to crystal travel she demonstrated that she understood my issues and set about resolving them fully she also had the patience to provide an explanation to me over and over as being hard of hearing and having to wear aids i needed to ensure i fully understood the advice given as it saved me from wasting a considerable sum of money an excellent example of customer support"
"roseglaiza saroldaloran","super service","excellent","twentyfive september twothousandtwentyfour","super service thank you john Morris for your assistance from start to finish appreciate it a lot"
"bh","good experience","excellent","one october twothousandtwentyfour","good experience i dealt with Sergio and he was so good"
"amandeep brar","i have booked my ticket from crystal","excellent","two october twothousandtwentyfour","i have booked my ticket from crystal travelers and Shirley helps me with that such a good experience"
"mari daisi mendoza","crusty is very precise","excellent","two october twothousandtwentyfour","crusty is very precise excellent and very thorough thank you"
"themba mparangu","amazing service","excellent","twentynine september twothousandtwentyfour","i had an amazing service from one of your sales consultants rm Oscar Lopez my moms flight schedule was changed to a longer layover which was going to inconvenience us greatly and l reached out for assistance to rm Oscar Lopez on Saturday he was professional collected and guided me through all the available flight options and went an extra mile to check if everything was okay and followed up on the query thank you for a wow service and assurance to a stressful journey"
"bharti radia","i am very pleased with the service","excellent","twentyseven april twothousandtwentyfour","i am very pleased with the service provided by crystal travels Jose Wilson who booked my tickets with very good price also Carolina ditz was very helpful overall very good customer service by Freya and Sergio thank you all very much"
"gemma mcmahon","spoke to Shirley smith who was patient","excellent","one october twothousandtwentyfour","spoke to Shirley smith who was patient and helpful with my request a brilliant member of staff"
"manjit singh","very humble gentleman rm James smith","excellent","one october twothousandtwentyfour","very humble gentleman rm James smith who dealt with every helpful all the way he spent lot of time with my questions and was very polite will definitely call again for more travel events business with your company we travel a lot may god bless James and keep him healthy"
"saffron davi","really good friendly people to talk","excellent","one october twothousandtwentyfour","really good friendly people to talk to Ryan smith was very helpful would recommend"
"kay","James was awesome worked to make my","excellent","one october twothousandtwentyfour","James was awesome worked to make my needs happen good dude"
"gari liquorish","great service","excellent","one october twothousandtwentyfour","spoke with carols Silva who was really professional and sorted out my tickets efficiently happy to deal with them again in the future"
"josh","very helpful","excellent","one october twothousandtwentyfour","very helpful quick and efficient in regards to the booking process i dealt with ash ton ditz who was immediately on call whenever an issue occurred and resolved it immediately"
"malcolm king","rehabbed made it quick and easy very","excellent","thirty september twothousandtwentyfour","rehabbed made it quick and easy very happy"
"ben","great service from Olivia Clark","excellent","twentysix september twothousandtwentyfour","Olivia Clark was helping and polite in dealing with the change of itinerary in regards of change of flight times"
"chris tomlinson","john Morris was very helpful and very","excellent","twentyfour september twothousandtwentyfour","john Morris was very helpful and very efficient and sorted out my flight very quickly he was happy to help with any questions i had"
"shahlah","clear was v help full thank u","excellent","one october twothousandtwentyfour","excellent service from Ronald at crystal travel"
"steve easter","excellent service from Ronald at","excellent","thirty september twothousandtwentyfour","had a really good experience with Nathan he checked and met my requirement for my holiday he was very patient"
"aa","had a really good experience with","excellent","thirty september twothousandtwentyfour","Nathan Cole was an excellent advisor who spent time with us to go through every available option for our requirements as well as this he explained everything to us really well"
"nan","Nathan Cole was an excellent advisor","excellent","thirty september twothousandtwentyfour","had a great experience using crystal travel with the help of Nathan he was patient with me especially when i asked a lot of questions"
"theo","had a great experience using crystal","excellent","thirty september twothousandtwentyfour","just want to thank Sergio for the professional customer service throughout the booking process tickets were booked for a reasonable price inspire of peak season crystal travel much recommendation"
"evo milroy deniz","hats off Sergio","excellent","thirty september twothousandtwentyfour","i just wanted to take a moment to share my positive experiences with crystal travels a company i have been relying on for my family travels over the last few years must say i have always been impressed with the level of service provided by crystal travels in particular i wanted to highlight my recent interaction with ms Shirley smith throughout the booking process she exhibited exceptional patience in providing me with various flight options and promptly addressing all my queries and concerns her professionalism and dedication to ensuring customer satisfaction truly stood out to meas a satisfied customer i wanted to express my gratitude and appreciation for the excellent service i have received from crystal travels i have every intention to continue using their services for all my upcoming flights confident that they will continue to deliver topnotch service thank you once again to the team at crystal travels and please pass on my compliments to ms Shirley smith for her outstanding assistance"
"mare adel de la cruz","excellent customer service","excellent","thirty september twothousandtwentyfour","very good experience with Aaron excellent service all way round"
"sy waqa ahm shah","very good service","excellent","thirty september twothousandtwentyfour","Aron many many thanks outstanding service"
"custom","very good experience with Aaron","excellent","thirty september twothousandtwentyfour","Olivia Clark dealt with our inquiry swiftly and efficiently and makes me believe crystal travel will always be our number flight booking company"
"custom","Aron many many thanks outstanding","excellent","thirty september twothousandtwentyfour","great service from Lisa smith and flared Shaw at crystal travel getting me the best deal on my tickets lets hope the flight is as smooth"
"elsi waligo","Olivia Clark dealt with our inquiry","excellent","thirty september twothousandtwentyfour","john treated me professionally"
"stephen","great service from Lisa and flared","excellent","twentynine september twothousandtwentyfour","service provided by Ronnie O'Connor was second to none most helpful person i have come across thanks Paul"
"richard akujobi","john treated me professionally","excellent","eighteen september twothousandtwentyfour","Nathan our adviser was so helpful and gave lots of advice and found flights at competitive prices i would definitely return to crystal travel for my future trips"
"paul duncan","service provided by Ronnie O'Connor was","excellent","twentynine september twothousandtwentyfour","thank you john Morris for your excellent service really appreciated also i will be using crystal travel for my future flights thank you"
"louis graham","excellent customer service","excellent","thirty september twothousandtwentyfour",NA
"saghir hussain","thank you john Morris for your","excellent","twelve september twothousandtwentyfour",NA
"raj","as always","excellent","thirty september twothousandtwentyfour","as always crystal travel generations was very efficient and polite"
"shaista","got the ticket in short time m glad to write my experience to","good","twentynine september twothousandtwentyfour","i am glad to write my experience to avail the services for my tour plan through crystal travel rm James smith offered me very reasonable fare for the said schedule and explained every detail regarding ticket i am very thankful to save my time i wish best of luck for the future endeavors"
