"Reviewer_name","Review_title","Rating","Date_of_experience","Review_description"
"billi","site price variance issue","good","twentyseven may twothousandtwentyfour","unfortunately the prices given for flights from UK to Australia on crystal travel website were not correct and i was immediately called by one of their agents to advise me that it would cost another approx to book those flights i dint let it rest and asked for an escalation it did cost around more however in comparison with other providers this was very reasonable the supervisory management team of jazz and buckram were extremely helpful in ensuring i got the best price possible and maintained communications until i was fully booked the only issue i have was the online price the staff after this were excellent and patient with a rather perturbed customer myself if not for the inability of the site to maintain accurate sales prices i would have given stars i did communicate with another couple of companies and have to say that crystal travel was of a much higher standard and i felt more comfortable and trusting when dealing with them thank you to jazz and buckram for your patience and assistance throughout"
"alan clover","cost effective and quick service","excellent","twentyeight may twothousandtwentyfour","search via cheap flights revealed crystal travel offered the best price for my trip to Hong gonk completion of details and payment via the website was painless a few hours later received a pleasant phone call from recap Wilson confirming issue of tickets so all done in a couple of hours thank you recap"
"lidia ulart","thank you so much rm Jerry Wilson very grateful to know you and highly recommended crystal travel to everyone","excellent","twentyfour may twothousandtwentyfour","thank you so much rm Jerry nondelivery grateful indeed to know you and highly recommended crystal travel to everyone"
"phuong nguyen","waste of time","bad","two may twothousandtwentyfour","such a horrible company you find them on a site like kayak where they quote you the cheapest price but then they lie and call you to tell you the couldn't book for that price and you need to pay more waste of time"
"lydia brahami","a very nice customer service agent","excellent","twentyeight may twothousandtwentyfour","a very nice customer service agent very professional and helpful"
"md hasan","carols has been brilliant","excellent","twentyeight may twothousandtwentyfour","carols has been brilliant very helpful"
"panita clark","definitely stars for this company","excellent","twentyeight may twothousandtwentyfour","i feel i have to give this company stars as the whole process of booking my flight was so smooth from start to finish i get very stressed when doing this sort of thing but not in this case"
"william morrison","well recommended travel agency staff is","excellent","twentyeight may twothousandtwentyfour","well recommended travel agency staff is knowledgeable they knew their job thank you rm nick Jonas for arranging everything"
"hanah dcumo","amazing help from peter Cruz","excellent","twentyeight may twothousandtwentyfour","just booked my flight for December alongside my partner and his family peter Cruz has been a great help to us today with our queries and booking and we cant thank you enough he made sure we got the best deals to make our money worth it and everything was smooth sailing peter was very attentive and answered any questions we had straight away and made sure we had all the information we needed"
"consum","great service","excellent","twentyeight may twothousandtwentyfour","great experience as always booking is smooth and easy process James smith helped book flights for my family and i he was very friendly and accommodating couldn't have asked for a better service"
"devi jhugroo","highly recommend crystal travel","excellent","twentyeight may twothousandtwentyfour","great customer service Aron was very helpful pay attention to every little details affordable price used crystal travel service few times quick service great team work thank you very much"
"ila christi","excellent staff helpful and supportive","excellent","twentyeight may twothousandtwentyfour","excellent staff helpful and supportive team members specially carols Silva and end stark thank you for your service and support"
"aminah","rm Sergio has been very excellent deal with my requests and he is responding back in every friendly professional way he tries his best to meet customer needs mi happy he dealt with me","excellent","twentysix may twothousandtwentyfour","the kind and professional expertise of Sergio made my shopping with crystal travel very easy i have got what i wanted and Sergio has been honest and responsible when dealing with me i have mad multiple payments but Sergio straight away called me to let me known even before i finished the transactions he is reliable and honest excellent human being well done region and think you for your services lamina"
"david wall","help when my flight was canceled","excellent","twentyeight may twothousandtwentyfour","i am due to travel to burglar in days time and BA canceled the flight and offered to put me on a flight to Munich instead arriving at getting to burglar at this time would be very difficult so i called crystal and spoke to christen who had forwarded beys information christen was able to get me onto a flight to Munich on the correct day arriving at with no additional cost and allowing me time to get a train to burglar the service i received was excellent christen understood the issue worked with me and got me onto a flight that gets me to my destination on time and also worked with my rail travel from Yorkshire to London avoiding any cost i have been impressed with crystal but the key measure for me is how a company reacts when things go wrong and in this case the service was excellent"
"natasha evan","fantastic experience guys thanks","excellent","twentyeight may twothousandtwentyfour","fantastic experience guys thanks"
"custom j mcmenamin","great service very helpful and","excellent","twentyeight may twothousandtwentyfour","great service very helpful and professional thanks again"
"custom","the customer service was outstanding","good","twentyeight may twothousandtwentyfour","the customer service was outstanding and nick demonstrated brilliance and was exceptionally helpful"
"consum","rd year booking my holiday","excellent","seventeen may twothousandtwentyfour","rd year booking my holiday all staff have been really helpful on this years booking i spoke to Jerry again completely hassle free will be calling to book my internal flights"
"ofelia ico","i am so happy today because of Ana she","excellent","twentyseven may twothousandtwentyfour","i am so happy today because of Ana she help me through all the way finding a perfect flight for usu highly recommend Ana for her being kind helpful and great customer service"
"custom","this was a fantastic experience crystal","excellent","twentyseven may twothousandtwentyfour","this was a fantastic experience crystal travel Ryan helped me a lot and he was very quick i have received my ticket thanks you"
"lionel young","fantastic personal service after flight","excellent","twentyfour may twothousandtwentyfour","fantastic personal service after flight schedule was canceled Carolina ditz was amazing"
"sajan gurung","Zara Lopez","excellent","twentyseven may twothousandtwentyfour","Zara lopes customer service was incredible she was polite and extremely helpful i was struggling to get a ticket for my Mrs and she found the right ticket after doing critical research i highly recommend others to use traversal"
"jacquelin rendal","a big thank you for peter very very","excellent","twentyseven may twothousandtwentyfour","a big thank you for peter very very helpful and a pleasure x"
"custom","Jose was very helpful and prompt with","excellent","twentyfive may twothousandtwentyfour","Jose was very helpful and prompt with his service he delivered as per our telephone conversation"
"dj","excellent customer service","excellent","twentyfour may twothousandtwentyfour","veronica is amazing so helpful made my purchase simple and easy excellent customer service"
"pritpal sagoo","egregious was excellent gave me all the","excellent","twentyseven may twothousandtwentyfour","egregious was excellent gave me all the information and completed the booking"
"ms e appiah","i just want to say a big thank you to","excellent","twentyfive may twothousandtwentyfour","i just want to say a big thank you to peter crusher was very polite friendly and patient he held the fare for me until the next day keep the good work peter"
"nas","naan helped me a lot","excellent","twentysix may twothousandtwentyfour","naan helped me a lot good service"
"luisa resmerita","great customer service","excellent","twentysix may twothousandtwentyfour","great customer service i booked my flights online on a Sunday my ticket was issued within the hour official timeline is h recap called me shortly after to make sure i got all details i need have any questions answered and provide an easy way to contact her if any questions come up later the flight shows in the airlines mobile app with the ticket details i was issued all went smooth and looks fine ahead of my flight"
"nasrin longfordlewi","a call from rm James smith i requested a call from crystal travel","excellent","twentyfive may twothousandtwentyfour","i requested a call from crystal travel after trying to book a flight to Istanbul on line and failing James smith called back and was very helpful booking my flight he was also very polite and efficient"
"michael robinson","very helpful good service","excellent","twentyfive may twothousandtwentyfour","very helpful friendly customer service agent Ben Oscar really professional"
"custom","very nice services good","excellent","twentyfive may twothousandtwentyfour","very nice services good"
"bundid","rm Mohamed","good","twentythree may twothousandtwentyfour","good service"
"lerma andrada","we are very much appreciated and happy","excellent","twentyfive may twothousandtwentyfour","appreciate your support feathery best help and quick response thank you"
"talal allaf","appreciate your support Freya","excellent","twentyfive may twothousandtwentyfour","booked flights for my family however at the payment stage it dint go through i got a call straightaway from Elena who explained that the return flight was so popular emirates decided to drastically increase the price however Elena was on the other line to emirates and even though offered cheaper alternatives she ensured a booking for me a smooth experience thanks"
"anon","booked flights for my family","excellent","nineteen may twothousandtwentyfour","i was confused with the baggage allowance be during the booking it includes kg check in baggage but upon receiving the confirmation email it only included carry on bag so i immediately called crystal travel and talked to Stella she explained that the ticket will arrive in a few hours after filling out a form via email that will be more detailed regarding the flight and baggage allowance thank you Stella and recap"
"rosabell arcina","confusion with baggage allowance","excellent","twentytwo may twothousandtwentyfour","i was initially frustrated with crystal travel as i was looking to book flights online and three times at the moment of payment the price would increase today i ended up speaking with Lisa smith and although persistent she was very friendly and patient with me and eventually found the flights i wanted at the price i was prepared to pay"
"toni brown","very helpful","good","twentyfour may twothousandtwentyfour",NA
"johnjulitt corodeanu","Freya has been really helpful","excellent","twentyfour may twothousandtwentyfour",NA
"daudi mugwanya","Shirley has been very helpful in this","good","twentyfour may twothousandtwentyfour","Shirley has been very helpful in this engagement thank you"
"rudolf","today i tried to book a flight on the","excellent","twentyfour may twothousandtwentyfour","today i tried to book a flight on the internet but it was extremely difficult to get a ticket for the date i wanted to fly finally i ended up with crystal travel and they gave me a good deal for a great price was helped by Albert Morgan and he talked me through the processable was very helpful and extremely experienced many thanks albeit will definitely contact you straight away when i need another flight in the future well done"
"steven bloomfield","she will contact the airlines and","excellent","twentyfour may twothousandtwentyfour","Freya will contact the airlines and raised my concern not having the leg room extra for us we were seated at the back"
"patiricia horsley","flight booking","excellent","twentytwo may twothousandtwentyfour","i was trying to book a business class flight ticket online and had a question so had to phone crystal travel i was passed to Lisa smith who was very helpful and clear in her explanations she immediately directed me to the right offer and also gave me a discount for it i will definitely go through her for our future bookings as she was very very helpful"
"mudrik ahmada","Shirley smith","excellent","twentyfour may twothousandtwentyfour","due to flight changes that my carrier had already informed me about i was contacted by christen at crystal travel christen emailed me all the details including transfer times after receiving updated transfers i realized connecting flights were very tight for time on my request christen promptly rescheduled to allow sufficient time for transfer very happy with the service i have received would happily recommend crystal travel"
"gregori wright","due to flight changes that my carrier","excellent","twentytwo may twothousandtwentyfour","very helpful got all sorted and tickets sent within a hour"
"consum","very helpful got all sorted and tickets","excellent","twentyfour may twothousandtwentyfour","i highly recommend Lisa as she is very helpful she has given me great service she looked for my good flight timing and great flight deal i am happy with her assistance and great communication"
"jacki silaghi","great Lisa","excellent","twentythree may twothousandtwentyfour","thank you recap a great first experience very professional and helpful"
"christoph bourgeoi","thank you recap","excellent","twentythree may twothousandtwentyfour","just made a booking very easy and quick to don hassles"
"gari","just made a booking","excellent","twentythree may twothousandtwentyfour","nick Jones helped me with making a payment i found him really helpful during my call great customer service at crystal travel have used in the past and glad i have chose them again"
"kyran jamal william","great customer service","excellent","twentythree may twothousandtwentyfour","bazaar helped me so much next time i will away plan my travel with him"
"carolin muwunganirwa","bazaar helped me so much next time i","excellent","twentythree may twothousandtwentyfour","frank is phenomenal i have used him times in the last months and each time he goes beyond and above once you have the right people in place life just flows frank is one of my people please get in touch with frank when calling crystal travel you will thank me later thank you frank a million times"
"clair marcham","frank is phenomenal","excellent","twentythree may twothousandtwentyfour","my name is claim happy i was able to book my tickets with this agency the amazing guy that guide me through is David very helpful very polite with a good manner thanks David i ill surely use this agency again"
"iwalola ayind","my name is Lola","excellent","twentythree may twothousandtwentyfour","had a confusion on checked bag allowance right after payment was made got in touch via the live chat and got connected to Freya who helped sort it out efficiently and very quickly thank you"
"n b ismail","had a confusion on checked bag","excellent","twentythree may twothousandtwentyfour","excellent customer service from Ronnie who was quick to get back to me once my booking dint go through he was swift professional and extremely helpful looking forward to my holiday"
"dannibe","excellent customer service from Ronnie","excellent","twentytwo may twothousandtwentyfour","i would to thank Steve for his patience with an elderly client like me really appreciate it"
"ketan desai","Aron has provided excellent service","excellent","twentythree may twothousandtwentyfour","Aron smith is very helpful with all the flight information and any questions that vie got thank you for your help"
"z jalil","i would to thank Steve for his patience","good","twentytwo may twothousandtwentyfour","very fast replies and helpful feedback from recap"
"t aung","Aron smith is very helpful with all the","excellent","twentytwo may twothousandtwentyfour",NA
"nicol murphi","very fast replies and helpful feedback","excellent","twentyone may twothousandtwentyfour",NA
"marta sk","great experience","excellent","twentytwo may twothousandtwentyfour","gray has been so helpful patient and found the best deal for me thank you"
"billa","good prices with fully supported staff","good","twentytwo may twothousandtwentyfour","veronica brooks was very helpful in finding me tickets she helped a lot with all my questions i would recommend her to everyone"
"isaac","veronica brooks was very helpful in","excellent","twentytwo may twothousandtwentyfour","the advisor end was very helpful and he made my experience very easy"
"nusrat khan","the advisor end was very helpful and he","excellent","twentytwo may twothousandtwentyfour","thanks end for a great service booking our direct ticket to Bangkok on Thai airways"
"jason","thanks end for a great service booking","excellent","twentytwo may twothousandtwentyfour","worst customer service over the phone other website shows luggage plus cabin luggage whilst booking crystal donor give this whole info"
"tanveer bandukda","worst customer service over the phone","bad","twentytwo may twothousandtwentyfour","thanks carols Silva for your exceptional customer service really appreciate it"
"kamran khan","thanks carols Silva for your","excellent","twentytwo may twothousandtwentyfour","my overall experience with crystal travel is very positive Lisa and Carolina were very helpful in procuring my flight to Thailand this coming Christmas hopefully this experience will continue and i can leave another positive review when i return"
"wilbert joseph","my overall experience with crystal","good","twentytwo may twothousandtwentyfour","i was sent the wrong ticket by someone else and Freya sorted the problem out very efficiently"
"lee huxley","a mistake quickly reversed","excellent","twentytwo may twothousandtwentyfour","dear freethinker you for your help and quick respond by email regarding my flights tickets"
"faisal mustafa","dear Freya","excellent","twentytwo may twothousandtwentyfour","we spoke to nick Jonas regarding seat booking he was very helpful and kind enough to hold the seats for us very good customer service"
"mr manzit afonso","we spoke to nick Jonas regarding seat","excellent","twentytwo may twothousandtwentyfour","my travel agent was very courteous and resolved my inquiry in an expeditious manner"
"john mitchel","Olivia was very helpful","excellent","twentytwo may twothousandtwentyfour","Olivia Clarke expeditiously dealt with my inquiry making my overall experience with crystal travel excellent"
"imona adebo","excellent and courteous customer service","excellent","twentytwo may twothousandtwentyfour","i recently booked a flight to Singapore through crystal travel and i had the pleasure of working with recap from start to finish she provided truly outstanding serviceability friendly and professional manner made the entire booking experience a breeze"
"marian madden","Olivia Clarke expeditiously dealt with","excellent","twentyone may twothousandtwentyfour","Ronald was very helpful from the outset and took time to understand my particular flight needs and to come up with the best solution and at a good price too"
"emmanuel","flight booking","excellent","twentyone may twothousandtwentyfour","very polite sales staff and very helpful easy to book with no problems good price i will be using them again"
"simeen kadi","Ronald was very helpful from the outset","excellent","nine may twothousandtwentyfour","scam prices price was gave all my details including credit card then click to pay price went up to had to block my card would not recommend or use this company"
"peap woolerton","very polite sales staff and very","excellent","twentyone may twothousandtwentyfour","it was a great satisfaction to deal with James smith who promptly helped me with a flight to Brazil you are a star thatch the way to do it"
"carl doyl","scam prices","bad","twentyone may twothousandtwentyfour","i received my authentic ticket soon after making a payment also received a call from the travel agent which is encouraging the agent asked me if everything was in order and gave me a number to call in case i encounter a problem"
"ms clement","it was a great satisfaction to deal","excellent","twenty may twothousandtwentyfour",NA
"obey","i received my authentic ticket soon","excellent","thirteen may twothousandtwentyfour",NA
"abdi ali","good service","excellent","twenty may twothousandtwentyfour","very helpful"
"lourd","cheapest fare compared to other online","good","nineteen may twothousandtwentyfour","cheapest fare compared to other online flight booking office we received our tickets shortly upon payment thanks Ryan"
"parsa","good travel agency","excellent","twenty may twothousandtwentyfour","good travel agency Sergio Gomez help me so much in finding my flight with best price"
"moaweya alksibati","bad service charge me for the seat while its free","bad","twenty may twothousandtwentyfour","mi really sorry but i have to change my reviews from to one star at the beginning iv had a good service then someone spoke and asked me to do the payment for the seat which i did then i called the middle east office to confirm the luggage weight and iv been told that no charge for that seats the worth place at the airplane had bad experience never will book again through this agent"
"aissa","each booking process and was very good","excellent","twenty may twothousandtwentyfour","each booking process and was very good in price had a custom service calm with recap whee id fully recommend thank you recap"
"luci","absolutely fantastic company helped me","excellent","twenty may twothousandtwentyfour","absolutely fantastic company helped me in a very hard situation Octavio was so kind and amazing i cant thank him enough will be using for all future travel"
"dr mukesh sinha","David brooks organized my ticket","excellent","twenty may twothousandtwentyfour","David brooks organized my ticket was very professional and competent answered all my queries"
"armageddon armada","excellent customer service","excellent","twenty may twothousandtwentyfour","i just contacted the crystal travel for reboot my seats as airline changed aircraft Stella was friendly and patient most of all very efficient solved my request i am very satisfied customer very definite use crystal again"
"ian danskin","so easy to navigate and a fair price","excellent","twenty may twothousandtwentyfour","so easy to navigate and a fair price"
"haseena lockhat","great customer service","excellent","nineteen may twothousandtwentyfour","Ana was amazing great customer care from start to finish excellent communication skills and she made sure everything was correct and complete before she signed off"
"sy haqu","Sergio Gomez has delivered excellent","excellent","twenty may twothousandtwentyfour","Sergio Gomez has delivered excellent service and offer me very good deal"
"niranjan jani","first time experience of crystal travel","excellent","twenty may twothousandtwentyfour","this is the first time i have used crystal travel just happened to see them on a comparison website i phoned and spoke to Sergio about my flight to Nairobi Sergio couldn't have been more helpful i feel he managed to get the best deal that he could for me and you cant ask for more than that i would certainly use crystal travel again"
"peter david ratcliff","thank you for booking my flight","excellent","twenty may twothousandtwentyfour","thank you for booking my flight Garry was very helpful the booking process was smooth simple thank you for your help"
"alwi chandana","Shirley is a very good and she helped","excellent","twenty may twothousandtwentyfour","Shirley is a very good and she helped very friendly"
"amz","exceptionally good experience","excellent","nineteen may twothousandtwentyfour","my experience with crystal travel has been exceptional i recently booked a trip with crystal travel and it was a very easy smooth service namely due to the travel agent veronica brooks she was very helpful and informative regarding our flight and the details of is always book with crystal travel for this very reason they give good travel deals and the agents are very friendly and helpful"
"jay","very easy and straight forward","excellent","nineteen may twothousandtwentyfour","very easy and straight forward got my tickets within a few minutes with a follow up call by recap to check if everything was OK will definitely use them again"
"esperanzaq gimutao","booking problem","excellent","twenty may twothousandtwentyfour","in my most recent experience with SAM i can say that he is a humble and kind person and i admire the way he handled the problem with my booking i was so delighted i hope that there will be more like him in the company thanks to him"
